{
  "$schema": "sampler_pruner_compatibility.v1.schema.json",
  "format": "n4m.hpo.sampler_pruner_compatibility",
  "schema_version": 1,
  "evidence_scope": {
    "level": "native_python_deterministic_conformance",
    "proves": [
      "all_45_plain_numeric_sampler_pruner_compositions_create_and_terminalize",
      "post_startup_tpe_and_gp_ei_proposals_diverge_from_their_random_fallback",
      "exact_replay_with_the_same_ordered_event_stream",
      "exact_public_checkpoint_continuation_for_each_cell",
      "stable_typed_status_for_declared_transverse_refusals"
    ],
    "does_not_prove": [
      "independent_sampler_algorithm_correctness_except_the_separate_sobol_reference",
      "independent_pruner_correctness_except_the_separate_selected_decision_references",
      "cross_binding_45_of_45_parity",
      "reproducibility_under_arbitrary_wall_clock_completion_order",
      "wall_clock_duration_reproducibility",
      "checkpoint_with_running_or_queued_pending_trials",
      "support_for_every_constrained_or_conditional_search_space"
    ]
  },
  "canonical_tape": {
    "seed": 1701,
    "n_trials": 20,
    "n_startup_trials": 3,
    "checkpoint_after_trials": 14,
    "checkpoint_state": "terminal_prefix_batch_boundary",
    "objective": "sphere",
    "event_order": "ASK_INTERMEDIATE_TERMINAL",
    "space": [
      { "kind": "int", "name": "k", "args": [1, 30] },
      { "kind": "float", "name": "x", "args": [-5.0, 5.0] }
    ]
  },
  "samplers": [
    { "id": "random", "schedule": "sequential_history", "adaptive_transition": { "kind": "none", "after_trials": 0, "minimum_completed": 0 } },
    { "id": "sobol", "schedule": "sequential_history", "adaptive_transition": { "kind": "none", "after_trials": 0, "minimum_completed": 0 } },
    { "id": "lhs", "schedule": "sequential_history", "adaptive_transition": { "kind": "none", "after_trials": 0, "minimum_completed": 0 } },
    { "id": "ternary", "schedule": "sequential_history", "adaptive_transition": { "kind": "none", "after_trials": 0, "minimum_completed": 0 } },
    { "id": "ga", "schedule": "generation_synchronous", "adaptive_transition": { "kind": "generation", "after_trials": 16, "minimum_completed": 1 } },
    { "id": "pso", "schedule": "generation_synchronous", "adaptive_transition": { "kind": "generation", "after_trials": 16, "minimum_completed": 1 } },
    { "id": "cmaes", "schedule": "generation_synchronous", "adaptive_transition": { "kind": "generation", "after_trials": 6, "minimum_completed": 1 } },
    { "id": "tpe", "schedule": "sequential_history", "adaptive_transition": { "kind": "startup_history", "after_trials": 3, "minimum_completed": 3 } },
    { "id": "gp_ei", "schedule": "sequential_history", "adaptive_transition": { "kind": "startup_history", "after_trials": 3, "minimum_completed": 3 } }
  ],
  "pruners": [
    { "id": "none", "intermediate": "compatibility_curve", "intermediate_steps": 4, "max_resource": 0, "reduction_factor": 0, "max_in_flight": 1, "tell_order": [0] },
    { "id": "median", "intermediate": "compatibility_curve", "intermediate_steps": 5, "max_resource": 0, "reduction_factor": 0, "max_in_flight": 1, "tell_order": [0] },
    { "id": "asha", "intermediate": "compatibility_curve", "intermediate_steps": 9, "max_resource": 0, "reduction_factor": 3, "max_in_flight": 1, "tell_order": [0] },
    { "id": "hyperband", "intermediate": "compatibility_curve", "intermediate_steps": 9, "max_resource": 9, "reduction_factor": 3, "max_in_flight": 1, "tell_order": [0] },
    { "id": "racing", "intermediate": "racing_observation", "intermediate_steps": 12, "max_resource": 0, "reduction_factor": 0, "max_in_flight": 2, "tell_order": [1, 0] }
  ],
  "cells": [
    { "sampler": "random", "pruner": "none", "status": "supported", "creation_status": "N4M_OK", "reason_code": "NATIVE_COMPOSITION_SUPPORTED", "schedule": "sequential_history", "reproducibility": "same_ordered_event_stream", "checkpoint": "save_restore_exact", "evidence": "native_python_deterministic_conformance" },
    { "sampler": "random", "pruner": "median", "status": "supported", "creation_status": "N4M_OK", "reason_code": "NATIVE_COMPOSITION_SUPPORTED", "schedule": "sequential_history", "reproducibility": "same_ordered_event_stream", "checkpoint": "save_restore_exact", "evidence": "native_python_deterministic_conformance" },
    { "sampler": "random", "pruner": "asha", "status": "supported", "creation_status": "N4M_OK", "reason_code": "NATIVE_COMPOSITION_SUPPORTED", "schedule": "sequential_history", "reproducibility": "same_ordered_event_stream", "checkpoint": "save_restore_exact", "evidence": "native_python_deterministic_conformance" },
    { "sampler": "random", "pruner": "hyperband", "status": "supported", "creation_status": "N4M_OK", "reason_code": "NATIVE_COMPOSITION_SUPPORTED", "schedule": "sequential_history", "reproducibility": "same_ordered_event_stream", "checkpoint": "save_restore_exact", "evidence": "native_python_deterministic_conformance" },
    { "sampler": "random", "pruner": "racing", "status": "supported", "creation_status": "N4M_OK", "reason_code": "NATIVE_COMPOSITION_SUPPORTED", "schedule": "sequential_history", "reproducibility": "same_ordered_event_stream", "checkpoint": "save_restore_exact", "evidence": "native_python_deterministic_conformance" },
    { "sampler": "sobol", "pruner": "none", "status": "supported", "creation_status": "N4M_OK", "reason_code": "NATIVE_COMPOSITION_SUPPORTED", "schedule": "sequential_history", "reproducibility": "same_ordered_event_stream", "checkpoint": "save_restore_exact", "evidence": "native_python_deterministic_conformance" },
    { "sampler": "sobol", "pruner": "median", "status": "supported", "creation_status": "N4M_OK", "reason_code": "NATIVE_COMPOSITION_SUPPORTED", "schedule": "sequential_history", "reproducibility": "same_ordered_event_stream", "checkpoint": "save_restore_exact", "evidence": "native_python_deterministic_conformance" },
    { "sampler": "sobol", "pruner": "asha", "status": "supported", "creation_status": "N4M_OK", "reason_code": "NATIVE_COMPOSITION_SUPPORTED", "schedule": "sequential_history", "reproducibility": "same_ordered_event_stream", "checkpoint": "save_restore_exact", "evidence": "native_python_deterministic_conformance" },
    { "sampler": "sobol", "pruner": "hyperband", "status": "supported", "creation_status": "N4M_OK", "reason_code": "NATIVE_COMPOSITION_SUPPORTED", "schedule": "sequential_history", "reproducibility": "same_ordered_event_stream", "checkpoint": "save_restore_exact", "evidence": "native_python_deterministic_conformance" },
    { "sampler": "sobol", "pruner": "racing", "status": "supported", "creation_status": "N4M_OK", "reason_code": "NATIVE_COMPOSITION_SUPPORTED", "schedule": "sequential_history", "reproducibility": "same_ordered_event_stream", "checkpoint": "save_restore_exact", "evidence": "native_python_deterministic_conformance" },
    { "sampler": "lhs", "pruner": "none", "status": "supported", "creation_status": "N4M_OK", "reason_code": "NATIVE_COMPOSITION_SUPPORTED", "schedule": "sequential_history", "reproducibility": "same_ordered_event_stream", "checkpoint": "save_restore_exact", "evidence": "native_python_deterministic_conformance" },
    { "sampler": "lhs", "pruner": "median", "status": "supported", "creation_status": "N4M_OK", "reason_code": "NATIVE_COMPOSITION_SUPPORTED", "schedule": "sequential_history", "reproducibility": "same_ordered_event_stream", "checkpoint": "save_restore_exact", "evidence": "native_python_deterministic_conformance" },
    { "sampler": "lhs", "pruner": "asha", "status": "supported", "creation_status": "N4M_OK", "reason_code": "NATIVE_COMPOSITION_SUPPORTED", "schedule": "sequential_history", "reproducibility": "same_ordered_event_stream", "checkpoint": "save_restore_exact", "evidence": "native_python_deterministic_conformance" },
    { "sampler": "lhs", "pruner": "hyperband", "status": "supported", "creation_status": "N4M_OK", "reason_code": "NATIVE_COMPOSITION_SUPPORTED", "schedule": "sequential_history", "reproducibility": "same_ordered_event_stream", "checkpoint": "save_restore_exact", "evidence": "native_python_deterministic_conformance" },
    { "sampler": "lhs", "pruner": "racing", "status": "supported", "creation_status": "N4M_OK", "reason_code": "NATIVE_COMPOSITION_SUPPORTED", "schedule": "sequential_history", "reproducibility": "same_ordered_event_stream", "checkpoint": "save_restore_exact", "evidence": "native_python_deterministic_conformance" },
    { "sampler": "ternary", "pruner": "none", "status": "supported", "creation_status": "N4M_OK", "reason_code": "NATIVE_COMPOSITION_SUPPORTED", "schedule": "sequential_history", "reproducibility": "same_ordered_event_stream", "checkpoint": "save_restore_exact", "evidence": "native_python_deterministic_conformance" },
    { "sampler": "ternary", "pruner": "median", "status": "supported", "creation_status": "N4M_OK", "reason_code": "NATIVE_COMPOSITION_SUPPORTED", "schedule": "sequential_history", "reproducibility": "same_ordered_event_stream", "checkpoint": "save_restore_exact", "evidence": "native_python_deterministic_conformance" },
    { "sampler": "ternary", "pruner": "asha", "status": "supported", "creation_status": "N4M_OK", "reason_code": "NATIVE_COMPOSITION_SUPPORTED", "schedule": "sequential_history", "reproducibility": "same_ordered_event_stream", "checkpoint": "save_restore_exact", "evidence": "native_python_deterministic_conformance" },
    { "sampler": "ternary", "pruner": "hyperband", "status": "supported", "creation_status": "N4M_OK", "reason_code": "NATIVE_COMPOSITION_SUPPORTED", "schedule": "sequential_history", "reproducibility": "same_ordered_event_stream", "checkpoint": "save_restore_exact", "evidence": "native_python_deterministic_conformance" },